{
  "$schema": "http://json-schema.org/draft-07/schema#",
  "$id": "study4f-e1-status-v1",
  "title": "Study 4F-E1 execution-successor lifecycle router",
  "description": "Restrictive schema for studies/study4f/execution-e1/STATUS.json. Every decision-bearing value is closed: no additional property is admitted anywhere, the lifecycle state must be one of the nine registered E1 terminal states, and every authorization flag, claim-boundary flag and operation counter is pinned to false or zero so a later edit cannot quietly widen what this successor is allowed to have done.",
  "type": "object",
  "additionalProperties": false,
  "required": [
    "schema_version", "study_id", "namespace", "is_authoritative_lifecycle_router",
    "routes_only_this_execution_successor", "lifecycle_state", "terminal",
    "study_kind", "authority", "predecessor", "reached_stage", "not_reached",
    "azure", "authorization_flags", "claim_boundary", "evidence_ledger",
    "shakedown_allowance", "zero_operation_counters", "test_differential",
    "what_this_state_establishes", "next_action_rule", "artifacts"
  ],
  "properties": {
    "schema_version": {"const": "study4f-e1-status-v1"},
    "study_id": {"const": "STUDY4F_E1"},
    "namespace": {"const": "studies/study4f/execution-e1/"},
    "is_authoritative_lifecycle_router": {"const": true},
    "routes_only_this_execution_successor": {"const": true},
    "lifecycle_state": {
      "enum": [
        "STUDY4F_E1_AWAITING_AZURE_GPU_QUOTA_APPROVAL",
        "STUDY4F_E1_QUALIFYING_ACCELERATOR_CAPACITY_UNAVAILABLE",
        "STUDY4F_E1_VISIBLE_GPU_MEMORY_BELOW_REGISTERED_REQUIREMENT",
        "STUDY4F_E1_SHAKEDOWN_FAILED_NO_STUDY_BANK_EXECUTION",
        "STUDY4F_E1_EXECUTION_INTERRUPTED_NO_REINTERPRETATION",
        "STUDY4F_E1_NO_NATURAL_POSITIVE_REFERENCE_QUALIFIED_WITHIN_REGISTERED_LADDER",
        "STUDY4F_E1_RP_DEV_IDENTIFIED_TARGET_NO_COT_HEADROOM",
        "STUDY4F_E1_RP_DEV_IDENTIFIED_TARGET_E0_NOT_OBSERVED",
        "STUDY4F_E1_BEHAVIORAL_FEASIBILITY_SUPPORTED_AWAITING_SEPARATE_CONFIRMATION"
      ]
    },
    "terminal": {"const": true},
    "study_kind": {"const": "resource_only_execution_successor_to_a_published_instrument"},
    "authority": {
      "type": "object",
      "additionalProperties": false,
      "required": ["path", "bytes", "sha256", "git_blob", "commit", "tree",
                   "parent_commit", "parent_tree",
                   "published_alone_as_the_first_commit_after_the_predecessor"],
      "properties": {
        "path": {"const": "studies/study4f/prompts/study4f_e1_qualifying_accelerator_execution_authority.md"},
        "bytes": {"type": "integer", "minimum": 1},
        "sha256": {"type": "string", "pattern": "^[0-9a-f]{64}$"},
        "git_blob": {"type": "string", "pattern": "^[0-9a-f]{40}$"},
        "commit": {"type": "string", "pattern": "^[0-9a-f]{40}$"},
        "tree": {"type": "string", "pattern": "^[0-9a-f]{40}$"},
        "parent_commit": {"const": "5fd9602df207e95789263d0f8d52428540f48fb8"},
        "parent_tree": {"type": "string", "pattern": "^[0-9a-f]{40}$"},
        "published_alone_as_the_first_commit_after_the_predecessor": {"const": true}
      }
    },
    "predecessor": {
      "type": "object",
      "additionalProperties": false,
      "required": ["study_id", "commit", "lifecycle_state_at_binding",
                   "original_authority_commit", "instrument_bound_byte_exactly",
                   "decision_bearing_files_verified", "files_that_differed",
                   "semantic_invariants_reconfirmed",
                   "semantic_invariants_that_failed", "study4f_status_modified",
                   "study4f_instrument_modified", "study4f_tests_modified",
                   "study3r_bytes_modified", "evidence_ledger_modified",
                   "e1_amends_or_reinterprets_the_predecessor"],
      "properties": {
        "study_id": {"const": "STUDY4F"},
        "commit": {"const": "5fd9602df207e95789263d0f8d52428540f48fb8"},
        "lifecycle_state_at_binding": {"const": "STUDY4F_UNQUANTIZED_RESOURCE_ROUTE_UNAVAILABLE"},
        "original_authority_commit": {"const": "7d5ff0837d77af9e6df9f49d580ec0e42bdc2729"},
        "instrument_bound_byte_exactly": {"const": true},
        "decision_bearing_files_verified": {"type": "integer", "minimum": 15},
        "files_that_differed": {"const": 0},
        "semantic_invariants_reconfirmed": {"type": "integer", "minimum": 13},
        "semantic_invariants_that_failed": {"const": 0},
        "study4f_status_modified": {"const": false},
        "study4f_instrument_modified": {"const": false},
        "study4f_tests_modified": {"const": false},
        "study3r_bytes_modified": {"const": false},
        "evidence_ledger_modified": {"const": false},
        "e1_amends_or_reinterprets_the_predecessor": {"const": false}
      }
    },
    "reached_stage": {
      "type": "object",
      "additionalProperties": false,
      "required": ["starting_state_verified", "registered_baseline_reproduced",
                   "authority_published_alone", "instrument_bound",
                   "azure_identity_used",
                   "read_only_resource_discovery_completed",
                   "quota_disposition_recorded",
                   "launcher_published_and_tested"],
      "properties": {
        "starting_state_verified": {"const": true},
        "registered_baseline_reproduced": {"const": true},
        "authority_published_alone": {"const": true},
        "instrument_bound": {"const": true},
        "azure_identity_used": {"const": true},
        "read_only_resource_discovery_completed": {"const": true},
        "quota_disposition_recorded": {"const": true},
        "launcher_published_and_tested": {"const": true}
      }
    },
    "not_reached": {
      "type": "object",
      "additionalProperties": false,
      "required": ["azure_resource_group_created", "vm_provisioned",
                   "deployment_attempted", "capacity_observed",
                   "runtime_preflight_measured_on_a_device",
                   "shakedown_attempted", "banks_realized",
                   "execution_seal_created",
                   "developmental_execution_authorized", "ladder_executed",
                   "rt_executed"],
      "properties": {
        "azure_resource_group_created": {"const": false},
        "vm_provisioned": {"const": false},
        "deployment_attempted": {"const": false},
        "capacity_observed": {"const": false},
        "runtime_preflight_measured_on_a_device": {"const": false},
        "shakedown_attempted": {"const": false},
        "banks_realized": {"const": false},
        "execution_seal_created": {"const": false},
        "developmental_execution_authorized": {"const": false},
        "ladder_executed": {"const": false},
        "rt_executed": {"const": false}
      }
    },
    "azure": {
      "type": "object",
      "additionalProperties": false,
      "required": ["subscription_salted_sha256", "subscription_last_four",
                   "subscription_id_committed", "tenant_id_committed",
                   "credentials_committed", "registered_sku_order",
                   "h100_attempted_before_a100", "regions_returned_for_h100",
                   "regions_returned_for_a100",
                   "regions_with_a_disqualifying_sku_restriction",
                   "azure_policy_blocks_a_registered_sku_or_region",
                   "quota_and_capacity_reported_separately",
                   "eligible_sku_region_pairs_with_sufficient_quota",
                   "family_vcpu_limit_in_every_returned_region",
                   "total_regional_vcpu_limit", "total_regional_vcpu_used",
                   "blocking_dimension", "capacity_observed",
                   "deployment_attempts", "spot_capacity_used",
                   "quota_requests_submitted", "quota_request_sku",
                   "quota_request_region", "quota_request_family_vcpus",
                   "quota_request_instances", "quota_request_id",
                   "quota_request_provisioning_state",
                   "quota_request_error_code", "quota_granted",
                   "larger_quota_requested", "operator_packet_published",
                   "resources_created", "resources_remaining",
                   "billable_accelerators_remaining"],
      "properties": {
        "subscription_salted_sha256": {"type": "string", "pattern": "^[0-9a-f]{64}$"},
        "subscription_last_four": {"type": "string", "pattern": "^[0-9a-z]{4}$"},
        "subscription_id_committed": {"const": false},
        "tenant_id_committed": {"const": false},
        "credentials_committed": {"const": false},
        "registered_sku_order": {
          "type": "array",
          "items": {"enum": ["Standard_NC40ads_H100_v5", "Standard_NC24ads_A100_v4"]},
          "minItems": 2, "maxItems": 2
        },
        "h100_attempted_before_a100": {"const": true},
        "regions_returned_for_h100": {"type": "integer", "minimum": 0},
        "regions_returned_for_a100": {"type": "integer", "minimum": 0},
        "regions_with_a_disqualifying_sku_restriction": {"type": "integer", "minimum": 0},
        "azure_policy_blocks_a_registered_sku_or_region": {"type": "boolean"},
        "quota_and_capacity_reported_separately": {"const": true},
        "eligible_sku_region_pairs_with_sufficient_quota": {"type": "integer", "minimum": 0},
        "family_vcpu_limit_in_every_returned_region": {"type": "integer", "minimum": 0},
        "total_regional_vcpu_limit": {"type": "integer", "minimum": 0},
        "total_regional_vcpu_used": {"type": "integer", "minimum": 0},
        "blocking_dimension": {"type": "string", "minLength": 1},
        "capacity_observed": {"type": "boolean"},
        "deployment_attempts": {"type": "integer", "minimum": 0, "maximum": 4},
        "spot_capacity_used": {"const": false},
        "quota_requests_submitted": {"type": "integer", "minimum": 0, "maximum": 1},
        "quota_request_sku": {"enum": ["Standard_NC40ads_H100_v5", "Standard_NC24ads_A100_v4"]},
        "quota_request_region": {"type": "string", "minLength": 1},
        "quota_request_family_vcpus": {"enum": [24, 40]},
        "quota_request_instances": {"const": 1},
        "quota_request_id": {"type": "string", "minLength": 1},
        "quota_request_provisioning_state": {"type": "string", "minLength": 1},
        "quota_request_error_code": {"type": ["string", "null"]},
        "quota_granted": {"type": "boolean"},
        "larger_quota_requested": {"const": false},
        "operator_packet_published": {"type": "boolean"},
        "resources_created": {"type": "integer", "minimum": 0},
        "resources_remaining": {"type": "integer", "minimum": 0},
        "billable_accelerators_remaining": {"const": 0}
      }
    },
    "authorization_flags": {
      "type": "object",
      "additionalProperties": false,
      "required": ["provisioning_authorized", "developmental_execution_authorized",
                   "model_execution_authorized", "quantization_authorized",
                   "sharding_authorized", "offload_authorized",
                   "device_map_auto_authorized", "unregistered_model_authorized",
                   "spot_capacity_authorized", "d0_authorized",
                   "activation_capture_or_patching_authorized",
                   "study3m_authorized", "confirmation_authorized",
                   "evidence_ledger_row_authorized",
                   "github_actions_run_authorized",
                   "threshold_or_estimand_change_authorized",
                   "reinterpretation_authorized"],
      "patternProperties": {"^.*$": {"const": false}}
    },
    "claim_boundary": {
      "type": "object",
      "additionalProperties": false,
      "required": ["rp_b_developmental_candidate_identified", "rp_b_confirmed",
                   "claims_j_space_exists", "claims_j_space_does_not_exist",
                   "claims_j_space_is_observable", "claims_j_space_is_unobservable",
                   "claims_the_model_cannot_reason_internally",
                   "claims_single_forward_reasoning_was_demonstrated",
                   "claims_the_interface_is_valid", "claims_the_interface_is_invalid",
                   "claims_any_result_generalizes", "is_a_scientific_result",
                   "is_a_negative_result_about_any_checkpoint",
                   "is_a_negative_result_about_azure_capacity"],
      "patternProperties": {"^.*$": {"const": false}}
    },
    "evidence_ledger": {
      "type": "object",
      "additionalProperties": false,
      "required": ["path", "last_row", "rows_added_by_study4f_e1", "sha256"],
      "properties": {
        "path": {"const": "paper/evidence_ledger.csv"},
        "last_row": {"const": "EV-0016"},
        "rows_added_by_study4f_e1": {"const": 0},
        "sha256": {"type": "string", "pattern": "^[0-9a-f]{64}$"}
      }
    },
    "shakedown_allowance": {
      "type": "object",
      "additionalProperties": false,
      "required": ["original_attempts_used", "original_attempts_permitted",
                   "e1_additional_attempts_permitted", "e1_attempts_used",
                   "total_accelerator_hours_permitted", "accelerator_hours_used",
                   "study_bank_outputs_inspected_during_shakedown"],
      "properties": {
        "original_attempts_used": {"const": 1},
        "original_attempts_permitted": {"const": 3},
        "e1_additional_attempts_permitted": {"const": 2},
        "e1_attempts_used": {"type": "integer", "minimum": 0, "maximum": 2},
        "total_accelerator_hours_permitted": {"const": 6},
        "accelerator_hours_used": {"type": "number", "minimum": 0, "maximum": 6},
        "study_bank_outputs_inspected_during_shakedown": {"const": 0}
      }
    },
    "zero_operation_counters": {
      "type": "object",
      "additionalProperties": false,
      "required": ["azure_resources_created", "deployment_attempts",
                   "checkpoint_downloads", "weight_files_acquired",
                   "model_constructions", "forward_passes", "prefill_operations",
                   "generations", "generated_tokens", "logit_reads",
                   "activation_collections", "activation_patches", "d0_runs",
                   "execution_seeds_drawn", "study_banks_realized",
                   "rp_b_selections", "gpu_seconds", "accelerator_hours",
                   "evidence_ledger_rows_written", "github_actions_runs",
                   "cells_executed", "cells_skipped"],
      "properties": {
        "azure_resources_created": {"const": 0},
        "deployment_attempts": {"const": 0},
        "checkpoint_downloads": {"const": 0},
        "weight_files_acquired": {"const": 0},
        "model_constructions": {"const": 0},
        "forward_passes": {"const": 0},
        "prefill_operations": {"const": 0},
        "generations": {"const": 0},
        "generated_tokens": {"const": 0},
        "logit_reads": {"const": 0},
        "activation_collections": {"const": 0},
        "activation_patches": {"const": 0},
        "d0_runs": {"const": 0},
        "execution_seeds_drawn": {"const": 0},
        "study_banks_realized": {"const": 0},
        "rp_b_selections": {"const": 0},
        "gpu_seconds": {"const": 0},
        "accelerator_hours": {"const": 0},
        "evidence_ledger_rows_written": {"const": 0},
        "github_actions_runs": {"const": 0},
        "cells_executed": {"const": 0},
        "cells_skipped": {"const": 16}
      }
    },
    "test_differential": {
      "type": "object",
      "additionalProperties": false,
      "required": ["registered_starting_baseline",
                   "baseline_reproduced_at_the_starting_commit",
                   "final_head_suite", "failure_node_ids_identical_to_the_starting_nine",
                   "new_non_scope_failures", "new_scope_expiries_recorded",
                   "historical_failures_edited_or_suppressed"],
      "properties": {
        "registered_starting_baseline": {"const": "9 failed, 5,119 passed, 16 skipped"},
        "baseline_reproduced_at_the_starting_commit": {"const": true},
        "final_head_suite": {"type": "string", "minLength": 1},
        "failure_node_ids_identical_to_the_starting_nine": {"type": "boolean"},
        "new_non_scope_failures": {"const": 0},
        "new_scope_expiries_recorded": {"type": "integer", "minimum": 0},
        "historical_failures_edited_or_suppressed": {"const": 0}
      }
    },
    "what_this_state_establishes": {
      "type": "object",
      "additionalProperties": false,
      "required": ["establishes", "does_not_establish"],
      "properties": {
        "establishes": {"type": "array", "items": {"type": "string"}, "minItems": 3},
        "does_not_establish": {"type": "array", "items": {"type": "string"}, "minItems": 5}
      }
    },
    "next_action_rule": {
      "type": "object",
      "additionalProperties": false,
      "required": ["statement", "requires_an_approved_gpu_quota",
                   "further_automatic_quota_requests_permitted",
                   "quantization_or_sharding_is_a_permitted_workaround",
                   "spot_capacity_is_a_permitted_workaround",
                   "ineligible_accelerator_substitution_is_a_permitted_workaround",
                   "the_instrument_may_be_reused_unchanged"],
      "properties": {
        "statement": {"type": "string", "minLength": 1},
        "requires_an_approved_gpu_quota": {"const": true},
        "further_automatic_quota_requests_permitted": {"const": false},
        "quantization_or_sharding_is_a_permitted_workaround": {"const": false},
        "spot_capacity_is_a_permitted_workaround": {"const": false},
        "ineligible_accelerator_substitution_is_a_permitted_workaround": {"const": false},
        "the_instrument_may_be_reused_unchanged": {"const": true}
      }
    },
    "artifacts": {
      "type": "object",
      "additionalProperties": false,
      "required": ["authority", "predecessor_instrument_manifest",
                   "predecessor_semantic_invariants", "azure_discovery",
                   "quota_disposition", "operator_quota_request_packet",
                   "instrument_binding", "resource_selection",
                   "runtime_preflight", "deployment_plan", "lifecycle",
                   "status_schema", "tests", "disclosure"],
      "patternProperties": {
        "^.*$": {"type": "string", "pattern": "^studies/study4f/"}
      }
    }
  }
}
