{
  "schema_version": "study4f-e1-status-v1",
  "study_id": "STUDY4F_E1",
  "namespace": "studies/study4f/execution-e1/",
  "is_authoritative_lifecycle_router": true,
  "routes_only_this_execution_successor": true,
  "lifecycle_state": "STUDY4F_E1_AWAITING_AZURE_GPU_QUOTA_APPROVAL",
  "terminal": true,
  "study_kind": "resource_only_execution_successor_to_a_published_instrument",
  "authority": {
    "path": "studies/study4f/prompts/study4f_e1_qualifying_accelerator_execution_authority.md",
    "bytes": 15373,
    "sha256": "4e8b036e1247d5e671fdfc8d66febb7ff0bf20f37e674fc3c46a9a596f5ac6ab",
    "git_blob": "a12dae7772e3dd4d2de32ddd278b99f37078a3ed",
    "commit": "58cdcda0ec3848ba2bd3a6c525b3c28ac8955d69",
    "tree": "a587a0de590645ccdd008828bda33ec531274767",
    "parent_commit": "5fd9602df207e95789263d0f8d52428540f48fb8",
    "parent_tree": "365a5d090e1474305143a7e5aa268db969e62069",
    "published_alone_as_the_first_commit_after_the_predecessor": true
  },
  "predecessor": {
    "study_id": "STUDY4F",
    "commit": "5fd9602df207e95789263d0f8d52428540f48fb8",
    "lifecycle_state_at_binding": "STUDY4F_UNQUANTIZED_RESOURCE_ROUTE_UNAVAILABLE",
    "original_authority_commit": "7d5ff0837d77af9e6df9f49d580ec0e42bdc2729",
    "instrument_bound_byte_exactly": true,
    "decision_bearing_files_verified": 15,
    "files_that_differed": 0,
    "semantic_invariants_reconfirmed": 13,
    "semantic_invariants_that_failed": 0,
    "study4f_status_modified": false,
    "study4f_instrument_modified": false,
    "study4f_tests_modified": false,
    "study3r_bytes_modified": false,
    "evidence_ledger_modified": false,
    "e1_amends_or_reinterprets_the_predecessor": false
  },
  "reached_stage": {
    "starting_state_verified": true,
    "registered_baseline_reproduced": true,
    "authority_published_alone": true,
    "instrument_bound": true,
    "azure_identity_used": true,
    "read_only_resource_discovery_completed": true,
    "quota_disposition_recorded": true,
    "launcher_published_and_tested": true
  },
  "not_reached": {
    "azure_resource_group_created": false,
    "vm_provisioned": false,
    "deployment_attempted": false,
    "capacity_observed": false,
    "runtime_preflight_measured_on_a_device": false,
    "shakedown_attempted": false,
    "banks_realized": false,
    "execution_seal_created": false,
    "developmental_execution_authorized": false,
    "ladder_executed": false,
    "rt_executed": false
  },
  "azure": {
    "subscription_salted_sha256": "9adb2550056c6e57f03aca51c3a82a4fed3808d9c17b9b0357f15260adc0bb59",
    "subscription_last_four": "d32e",
    "subscription_id_committed": false,
    "tenant_id_committed": false,
    "credentials_committed": false,
    "registered_sku_order": [
      "Standard_NC40ads_H100_v5",
      "Standard_NC24ads_A100_v4"
    ],
    "h100_attempted_before_a100": true,
    "regions_returned_for_h100": 25,
    "regions_returned_for_a100": 15,
    "regions_with_a_disqualifying_sku_restriction": 0,
    "azure_policy_blocks_a_registered_sku_or_region": false,
    "quota_and_capacity_reported_separately": true,
    "eligible_sku_region_pairs_with_sufficient_quota": 0,
    "family_vcpu_limit_in_every_returned_region": 0,
    "total_regional_vcpu_limit": 100,
    "total_regional_vcpu_used": 0,
    "blocking_dimension": "VM-family vCPU quota",
    "capacity_observed": false,
    "deployment_attempts": 0,
    "spot_capacity_used": false,
    "quota_requests_submitted": 1,
    "quota_request_sku": "Standard_NC40ads_H100_v5",
    "quota_request_region": "australiaeast",
    "quota_request_family_vcpus": 40,
    "quota_request_instances": 1,
    "quota_request_id": "a6817961-e0f7-4cbe-a1ef-7ac4104e1089",
    "quota_request_provisioning_state": "Failed",
    "quota_request_error_code": "QuotaNotAvailableForResource",
    "quota_granted": false,
    "larger_quota_requested": false,
    "operator_packet_published": true,
    "resources_created": 0,
    "resources_remaining": 0,
    "billable_accelerators_remaining": 0
  },
  "authorization_flags": {
    "provisioning_authorized": false,
    "developmental_execution_authorized": false,
    "model_execution_authorized": false,
    "quantization_authorized": false,
    "sharding_authorized": false,
    "offload_authorized": false,
    "device_map_auto_authorized": false,
    "unregistered_model_authorized": false,
    "spot_capacity_authorized": false,
    "d0_authorized": false,
    "activation_capture_or_patching_authorized": false,
    "study3m_authorized": false,
    "confirmation_authorized": false,
    "evidence_ledger_row_authorized": false,
    "github_actions_run_authorized": false,
    "threshold_or_estimand_change_authorized": false,
    "reinterpretation_authorized": false
  },
  "claim_boundary": {
    "rp_b_developmental_candidate_identified": false,
    "rp_b_confirmed": false,
    "claims_j_space_exists": false,
    "claims_j_space_does_not_exist": false,
    "claims_j_space_is_observable": false,
    "claims_j_space_is_unobservable": false,
    "claims_the_model_cannot_reason_internally": false,
    "claims_single_forward_reasoning_was_demonstrated": false,
    "claims_the_interface_is_valid": false,
    "claims_the_interface_is_invalid": false,
    "claims_any_result_generalizes": false,
    "is_a_scientific_result": false,
    "is_a_negative_result_about_any_checkpoint": false,
    "is_a_negative_result_about_azure_capacity": false
  },
  "evidence_ledger": {
    "path": "paper/evidence_ledger.csv",
    "last_row": "EV-0016",
    "rows_added_by_study4f_e1": 0,
    "sha256": "3821730c45b7a58d3c582b38ba354eae77558fa4d419a51e9ff4fdf120411ff1"
  },
  "shakedown_allowance": {
    "original_attempts_used": 1,
    "original_attempts_permitted": 3,
    "e1_additional_attempts_permitted": 2,
    "e1_attempts_used": 0,
    "total_accelerator_hours_permitted": 6,
    "accelerator_hours_used": 0,
    "study_bank_outputs_inspected_during_shakedown": 0
  },
  "zero_operation_counters": {
    "azure_resources_created": 0,
    "deployment_attempts": 0,
    "checkpoint_downloads": 0,
    "weight_files_acquired": 0,
    "model_constructions": 0,
    "forward_passes": 0,
    "prefill_operations": 0,
    "generations": 0,
    "generated_tokens": 0,
    "logit_reads": 0,
    "activation_collections": 0,
    "activation_patches": 0,
    "d0_runs": 0,
    "execution_seeds_drawn": 0,
    "study_banks_realized": 0,
    "rp_b_selections": 0,
    "gpu_seconds": 0,
    "accelerator_hours": 0,
    "evidence_ledger_rows_written": 0,
    "github_actions_runs": 0,
    "cells_executed": 0,
    "cells_skipped": 16
  },
  "test_differential": {
    "registered_starting_baseline": "9 failed, 5,119 passed, 16 skipped",
    "baseline_reproduced_at_the_starting_commit": true,
    "final_head_suite": "9 failed, 5,119 passed, 16 skipped",
    "failure_node_ids_identical_to_the_starting_nine": true,
    "new_non_scope_failures": 0,
    "new_scope_expiries_recorded": 0,
    "historical_failures_edited_or_suppressed": 0
  },
  "what_this_state_establishes": {
    "establishes": [
      "The published Study 4F instrument binds byte-exactly at 5fd9602df207e95789263d0f8d52428540f48fb8: all fifteen decision-bearing files and all thirteen registered semantic invariants were reconfirmed without modifying anything.",
      "On the authenticated Azure identity available to this successor, both registered accelerator SKUs are offered broadly and neither carries a NotAvailableForSubscription restriction, so SKU availability and Azure Policy are not the blocking dimension.",
      "The blocking dimension is VM-family vCPU quota: the StandardNCadsH100v5Family and StandardNCADSA100v4Family limits are zero in every region returned for the respective SKU, while the total-regional vCPU limit of 100 would have admitted one instance.",
      "Exactly one minimal quota request was submitted, for exactly one instance of the first eligible SKU/region, and the quota service refused it with QuotaNotAvailableForResource. The family limit remains zero.",
      "No prohibited workaround was taken: no quantization, no sharding, no CPU or disk offload, no device_map='auto', no Spot capacity, no ineligible accelerator substitution and no enlarged quota request."
    ],
    "does_not_establish": [
      "Nothing about Azure GPU capacity, which was never observed because section 4.1 forbids provisioning without quota. Capacity is unknown, not unavailable.",
      "Nothing about whether any registered checkpoint has generated-CoT task headroom on D2 or on D3, because no cell was executed.",
      "Nothing about whether any registered checkpoint shows zero-generated-reasoning-token expressed competence, because no E0 cell was executed.",
      "Nothing about whether a natural positive-reference candidate exists in the registered ladder, because the ladder was never run.",
      "Nothing about whether J-space exists, is observable or is unobservable; neither Study 4F nor this successor tested any of these and neither could have.",
      "Nothing about whether the raw direct-answer interface is valid or invalid, because it was never exercised against a model.",
      "Nothing that generalizes beyond the registered checkpoints, depths and interface, because there is no result to generalize."
    ]
  },
  "next_action_rule": {
    "statement": "Study 4F-E1 stops at the registered section 4.1 state. Resuming requires an approved VM-family vCPU quota of 40 for Standard_NC40ads_H100_v5, or 24 for Standard_NC24ads_A100_v4, in a region that is otherwise eligible. The self-service quota API already refused the single permitted request, so approval must come through the operator-facing packet. Once quota exists the successor re-runs read-only discovery, enters section 4.2 with at most four on-demand attempts, and continues with the instrument unchanged.",
    "requires_an_approved_gpu_quota": true,
    "further_automatic_quota_requests_permitted": false,